{
  "$schema": "https://modellang.dev/schemas/event-manifest.schema.json",
  "eventManifestVersion": 5,
  "model": {
    "id": "model:Procurement",
    "name": "Procurement",
    "version": "0.44.0",
    "sourceHash": "sha256:84e7abae9beb6cd7f0466bf493c9b80166817a6e2718f7762ca3a3b7ab7d4c61"
  },
  "delivery": {
    "semantics": "atLeastOnce",
    "storage": "privateTransactionalOutbox",
    "ordering": "occurredAtThenProducerOrdinal",
    "acknowledgement": "leaseToken",
    "envelopeVersion": 2
  },
  "events": [
    {
      "id": "event:evt_10d694c9a0a274dc79c6168e47d25968",
      "name": "RequestOpened",
      "payloadEntityId": "entity:ent_9bc680209327484c8e98f5f740bcc702",
      "source": {
        "kind": "local"
      },
      "publicationFailurePolicy": {
        "mode": "deadLetterAfterMaxAttempts",
        "maxAttempts": 5,
        "recovery": "manual"
      },
      "emittedByActionIds": [
        "action:act_1e35db0451b1461e941af6283d86dca2"
      ],
      "emittedByConsumerIds": []
    },
    {
      "id": "event:evt_20d694c9a0a274dc79c6168e47d25968",
      "name": "RequestSubmitted",
      "payloadEntityId": "entity:ent_9bc680209327484c8e98f5f740bcc702",
      "source": {
        "kind": "local"
      },
      "publicationFailurePolicy": {
        "mode": "deadLetterAfterMaxAttempts",
        "maxAttempts": 5,
        "recovery": "manual"
      },
      "emittedByActionIds": [
        "action:act_ed2374e822704c51a2925338253d05d2"
      ],
      "emittedByConsumerIds": []
    },
    {
      "id": "event:evt_30d694c9a0a274dc79c6168e47d25968",
      "name": "RequestApproved",
      "payloadEntityId": "entity:ent_9bc680209327484c8e98f5f740bcc702",
      "source": {
        "kind": "local"
      },
      "publicationFailurePolicy": {
        "mode": "deadLetterAfterMaxAttempts",
        "maxAttempts": 5,
        "recovery": "manual"
      },
      "emittedByActionIds": [
        "action:act_d39dbb883b5f4019b9027b85add3de47"
      ],
      "emittedByConsumerIds": []
    },
    {
      "id": "event:evt_50d694c9a0a274dc79c6168e47d25968",
      "name": "ApprovalObserved",
      "payloadEntityId": "entity:ent_9bc680209327484c8e98f5f740bcc702",
      "source": {
        "kind": "local"
      },
      "publicationFailurePolicy": {
        "mode": "deadLetterAfterMaxAttempts",
        "maxAttempts": 5,
        "recovery": "manual"
      },
      "emittedByActionIds": [],
      "emittedByConsumerIds": [
        "consumer:con_10d694c9a0a274dc79c6168e47d25968"
      ]
    }
  ]
}
